tweet_id	tweet_text	class_label	hashtags	mentions	text_length	text_length_category	class_label_encoded	hashtags_frequency	hashtags_sentiment	hashtags_topics
1488240683035107328	المناعة الناتجة عن التعافي من الإصابة ليست كافية للوقاية من المتحورات، ويحتاج المتعافي من فيروس كورونا إلى أخذ اللقاح لتعزيز مناعته، حيث يمكنه أخذ اللقاح بعد التعافي مباشرة.	Yes			173	100+	1	0	0.0	0
1482828054254829574	الجارديان: بريطانيا تتخلص من الجرعات الثالثة التعزيزية للقاح كورونا وترميها بسبب ضعف الطلب عليها من السكان.	Yes			107	100+	1	0	0.0	0
1499067007454617604	تسعة لقاحات كورونا (كوفيد-19) معتمدة في المملكة. يمكنك طلب اعتمادها عند تلقيها في الخارج وتسجيلها في النظام عبر الموقع الالكتروني 	Yes			130	100+	1	0	0.0	0
1485581302485106690	وكيل الصحة: قد لا نحتاج أن نربط حضور الأطفال بالمدارس مقابل حصولهم على اللقاح.	Yes			78	71-80	1	0	0.0	0
1482449591995928580	"سنشهد عصراً ملييء بأمراض العقم مليء بمشاكل القلب مليء بمشاكل الكبد والكلى أكثر من السابق و سددون لكم الأسباب بعيداً على اللقاح لكن السبب الحقيقي هو اللقاح المعدل الجيني الخاص ب mRNA بحجة قضاءه على كورونا Save this Tweet"""	Yes			222	100+	1	0	0.0	0
1503389242474573827	رئيس شركة فايزر الأمريكية : معظم الناس سيحتاجون لجرعة رابعة من اللقاح ضد فيروس كورونا المستجد لحمايتهم من العدوى؛ لأن نظام الجرعتين الأوليتين ومعه الجرعة الداعمة، غير قادر على الحماية من المتغيرات. . . واشنطن	Yes			208	100+	1	0	0.0	0
1488997358390108167	جلسة اليوم 1 / 2 / 2022 كورونا : وزير الصحه ليش ماتسمح للدكاتره يصرحون بالحقيقه ليش مبطلين مكتب لمنظمة الصحه العالميه لايجوز لكم إجبار الناس على التطعيم أو منعهم من السفر لايوجد دليل مؤكد من غير فايزر والمتواطئين معها أن هذا اللقاح يشفي أو يحمي	Yes			244	100+	1	0	0.0	0
1556338845469364229	"فاوتشي في مقابلة سابقة لقاح الجدري فعال لكن له آثار جانبية سامة وقد يكون مميتا لضعاف المناعة"" للأسف كثير من سكان العالم الآن فقدوا مناعتهم بفعل لقاحات كوفيد لذلك سيكون لقاح جدري القرود قاتلا لهؤلاء بعدها ستنسب وفيات اللقاح للجدري كما حدث مع كوفيد لتبرير مزيد من الجرعات المضرة"	Yes			278	100+	1	0	0.0	0
1550895289413795841	"مدير منظمة الصحة العالمية يقول   لقد قررت أن جدري القرود أصبح يشكّل حالة طوارئ صحية عالمية "" تعليق١ تم حسم الأمر: جدري القرود الآن ثم سيتبعه فيروس غانا تعليق٢ بيل قيتس قبل سنوات: يتوجب أن تكون اللقاحات جزء من النظام الصحي في كل دولة من دول العالم"	Yes			248	100+	1	0	0.0	0
1480177188137750528	د. سليم الكريّع: انتفاخ مكان جرعة #لقاح_كورونا تفاعل مناعي جلدي مؤقت وغير مقلق و ليس بنادر، ويُنصح باستخدام كمادات الثلج و كريم الكورتيزون الموضعي مثل Elica لمدة 3 أيام.	Yes	لقاح_كورونا		169	100+	1	1	0.0	3
1477681641258733568	قائد الحرس الثوري الإيراني يتلقى لقاح نورا ضد كورونا الذي ينتجه الحرس الثوري (المفارقة ان اللقاحطى وقائد الحرس يرتدي ملابسه العسكرية )	Yes			134	100+	1	0	0.0	0
1521570259437817857	يجب أن يتم الاعلان عن كل حالة وفاة لطفل بالتلف الكبدي عما إذا كان ملقحا أم لا، وإن كان يرضع من أم ملقحة كما يجب الإعلان عن كل حالة تسمم في الدم أو مشكلة في القلب عما إذا كان المتضرر ملقحا أم لا أتمنى ممن أخذ اللقاح تجنب الجماع المباشر والرضاعة ع الاقل سنة حتى تتضح التجربة	No			272	100+	0	0	0.0	0
1488821092810690565	كلام يجب أن يقال: بعد سنتين من الطواريء بسبب كورونا والكثير من الاحترازات والتضييق على البشر فقد تبين أن الكثير من رافضي التطعيم لم يصبهم كورونا. والكثير من الملقحين أصابهم! قد يكون التطعيم حمى أرواح بعض الناس لكن يجب أن لا يكون سلاحاً ضد غير الملقحين لمنعهم من السفر وغيره.	Yes			274	100+	1	0	0.0	0
1488233206503591936	"فرنسا.. رفع دعوى ضد عقد بين شركة فايزر"" والدولة بعد إصابة طفل بالعمى عقب تلقيه جرعة لقاح كورونا - RT Arabic"	Yes			109	100+	1	0	0.0	0
1422031030362456066	شعور مزعج جداً، لقاح آمن أُخذ منه أكثر من ٤ مليار جرعة. اكتشافه كان حلم، وتحقق بفضل الله بعد تسخير الإمكانات المادية والعلمية، العلم يتطور وللأسف البعض يتأثر بكلام جهال. حزين لأن 99% من المتوفين الآن غير مطعمين إذا لم تحفز أقاربك للتطعيم، احذر أن تكون سبب لوفاتهم بتحذيرهم منه	Yes			276	100+	1	0	0.0	0
1379776312261410817	#فايزر الحمدلله أخذنا الجرعة الأولى من لقاح كورونا أسأل الله أن يجعل فيه البركة والعافية	No	فايزر		88	81-90	0	1	0.0	1
1527485923205652480	ندمت كثيراً على قرار #التطعيم حيث كان بعده إحساس بالخمول والتعب والكسل ثم نسيان وعدم التركيز ومع كل ذلك الآن ألم بالقلب وعدم إنتظام دقات القلب و آلام متفرقة. أسأل الله تعالى الشفاء لي ولكل مريض لا سيما من انخدع مثلي وأخذ اللقاح الذي الآن معظم الدول لم تعتمده للسفر وغيره لقد خدعنا	Yes	التطعيم		280	100+	1	1	0.0	0
1489914954480328704	انا ممنوعه من السفر ومن دخول النوادي و المجمعات والصالونات والسينما و المسارح والحدائق والمطاعم والمتاحف فقط لأنني لا أريد أخذ لقاح جيني تجريبي أثبت أنه لا يمنع الاصابة او منع عدوى ڤيروس يشبه الانفلونزا! الحريات لا تتجزأ! #معا_لدعم_الحريات #الحرية_الطبية	Yes	معا_لدعم_الحريات الحرية_الطبية		254	100+	1	2	0.0	0
1483137041730703364	أطفالنا سر بهجتنا وسعادتنا، وسلامتهم من سلامتنا. لقاح كورونا متاح للفئة العمرية من (5-11) سنة، تفضل بحجز موعداً لهم. #جاء_دورنا	No	جاء_دورنا		127	100+	0	1	0.0	3
1560496467147620354	شركة امون للأدوية المملوكة للكنيسة الارذوكسية تم بها لمستثمر يهودي يحمل الجنسية الإماراتية مقابل مليار دولار بماني أن جم الأدوية التي تنتجها شركة آمون ستكون صناعة إسرائيلية.. كانت الشركة قد أعلنت في وقت سابق انها بصدد إنتاج لقاح كورونا .. #التطب_خيانة #جزيره_الوراق	Yes	التطبيع_خيانة جزيره_الوراق		265	100+	1	2	0.0	0
1522052092885622784	فايزر نزلت ال ٨٠ ألف ورقة اه والله ٨٠ ألف فعلا . بأختصار الورق بيقولك أن تطعيم الكورونا ولا كان أمن ولا كان فعال،وانه بمل كوارث وانت و حظك على حسب مناعتك وچيناتك هما اللي هيحددوا هتلبس في اني مرض فيهم ومش شرط يظهر علي طول لا بالعكس هيظهر علي المدي الطويل،لقد تم الكدب عليك بنجاح	Yes			278	100+	1	0	0.0	0
1491332926419914756	"للاسف الحالة صحيحة .. المرحومة ابتسام دشتي من تقرير الطب الشرعي""ربط وفاتها بتخثرات حديثة مع تلقي لقاح ""اكسفورد""بالتحديد..زوجها تحدث لي ، ولم نشأ اعلان ذلك الا بعد التأكد،وتجنب اثارة الهلع عموما،وبطلب زوجها شخصياً ، وطبعا لكل دواء او لقاح آثاره ومضاعفاته التي يجب أن لانغفل عنها"	Yes			279	100+	1	0	0.0	0
1527626496839282689	جدري القرود : مرض فيروسي نادر يحدث عادة في افريقيا المناطق الاستوائية الماطرة، عادة يشفى المريض لوحده خلال ٢-٤ اساب، لا ينتقل عن طريق الهواء   بل يحتاج سوائل الجسم او من الحيوانات كالقوارض، تطعيم الجدري السابق يحمي بنسبة ٨٥٪ منه وله تطعيم أيضًا. تجنب الاعلام فلا قلق بحول الله	Yes			276	100+	1	0	0.0	0
1536317783847358470	ثالثًا: تـكـون مـدة اشتراط أخـذ الجرعة التنشيطية (الثالثة) من لقاح (كوفيد-19) لمغادرة المواطنين إلى خارج المملكـة (ثمانيـة) أشـهر بـدلاً مـن (ثلاثة) أشهر مـن تلقـي الجرعة الثانية، ويستثنى مـن ذلـك الفئات العمرية الـتـي تحـددها وزارة الصحة أو المستثناة. #واس_عام	Yes	واس_عام		261	100+	1	1	0.0	3
1530115243543826435	فضيحة عالمية: كبار المسؤولين والأطباء ومديروا كبرى الشركات رفضوا لقاحات mRNA ضد كوفيد واستصدروا بطاقات لقاح مزورة. طبقا للدكتور بول ألكسندر مستشار البيت الأبيض السابق لـ COVID والأستاذ المساعد في جامعة ماكماستر	Yes			210	100+	1	0	0.0	0
1499123431417303047	ويقولك لو تاخذ اللقاح يوميا لمدة شهر ما يصير فيك شي	No			51	51-60	0	0	0.0	0
1477671767002996736	خبر | حفاظا على سلامة اللاعبين إدارة #النصر تحجز موعد لاخذ الجرعة الثالثه من لقاح كورونا لكافة منسوبي النادي غدًا باذن الله ..	Yes	النصر		126	100+	1	1	0.0	0
1479726505022443529	حالة محصن بالجرعة التنشيطية الثالثة من لقاح كورونا ؛ ستصبح شرطاً لدخول جم الأنشطة والفعاليات في المملكة بدءًا من 1-2-2022م. . . السعودية	Yes			136	100+	1	0	0.0	0
1521975700760186880	ما تم نشره اليوم من مستندات #Pfizer بأمر من المحكمه يؤكد ان لقاحات كورونا لا ينصح بها للحامل و المرضعه على عكس نصائح المنظمه و ان فعاليتها للجم أقل بكثير مما تم التسويق له.. طبعًا كلما تم نشر فضيحه من فضايح هيلق ابليس نجد ان هناك قصص للتلهية و تكتيم. #اغلاق_مكتب_منظمة_الصحة	Yes	Pfizer اغلاق_مكتب_منظمة_الصحة		274	100+	1	2	0.0	0
1486299673979760645	كل المصابين باوميكرون بعد لقاحين وجرعة تنشيطية في منتهي خفة الدم وبيهزروا علي كفاءة اللقاحات، هي السبب انهم عايشين وبيهزروا ! من اول يوم لم يدعي احد ان اللقاح يمنع العدوي تماما، هو يقلل الي نسبة شبه كاملة فرص العدوي المميتة، اللقاح ليس بديلا للكمامات والاحتراز، تعيشوا وتهزروا.	Yes			277	100+	1	0	0.0	0
1484633097002008584	البيانات الآن واضحة بأن المناعة الربانية بعد الاصابة بكوفيد أكثر فعالية من مناعة اللقاح الوضعية .. لكن للأسف، تتقيد حقوق الكثير من الناس لان المناعة في اجسادهم لا تعترف بها السلطات  	Yes			182	100+	1	0	0.0	0
1486011200664219651	المجلس الصحي السعودي: لس هناك علاقة للقاح كورونا باعتلالات القلب..احذروا من الشائعات.	Yes			85	81-90	1	0	0.0	0
1485011492495896576	طُلب من سلطة الضفة الغربية إدانة تحركات غزة ضد الحرمين الشريفين واستغراب وقوف عدد كبير من ابناء فلسطين وخاصة الجهاد الإسلامي وحماس في غزة ضد اهل اليمن والسعودية والإمارات..فطالبت السلطة ب3مليون دولار لإصدار البيان.للمعلومة الإمارات إلى الآن ترسل لغزة لقاحات كورونا مجاناً #امجد_طه	Yes	امجد_طه		280	100+	1	1	0.0	0
1241394579913478145	مبادرة / تحت هذه التغريدة سأقوم بنشر كتاب (الألعاب الحركية )وهو باكورة الكتب الخاصة.. وكان صدوره عام 1423 قبل 18 عاماً تقريباً . #السعودية #كورونا_الجديد #خليك_في_البيت #مبادره_مجتمع_واحد	No	السعودية كورونا_الجديد خليك_في_البيت مبادره_مجتمع_واحد		187	100+	0	4	0.0	1
1537504678325493760	"قبل سنة ، ظهر الدكتور فاوتشي وقال  عندما يأخذ الناس اللقاح لن يصابوا بكورونا "" أمس أصيب فاوتشي بكورونا ، رغم أنه أخذ جرعتي لقاح وجرعتين معززتين لعل ما أصابه زكام وليس كورونا ، أو لعله أصيب بكورونا لحكمة لالمها إلا هو وبيل قيتس وجورج سورس وجستن ترودو ورئيسة وزراء نيوزيلندا"	Yes			274	100+	1	0	0.0	0
1484053023773138944	الحكومه النرويجيه: ١-لا توصي بتطعيم الأطفال الأصحاء من٥ الى١١ سنه ٢-لاتوصى بالجرعه الثانيه بشكل عام من١٢ الى١٥ سنه لقلة الفائده لهذه الفئه ومقارنتها بزيادة خطر التهاب عضلة القلب ٣-الجرعات متوفره للجم إختياريا لمن يرغب أو يريد تطعيم أطفاله #وزارة_الصحة	Yes	وزارة_الصحة		251	100+	1	1	0.0	4
1536814161279307777	وكيل الصحة: عدد الوفيات التي منعتها لقاحات كورونا في المملكة بلغت نحو 82 ألف وفاة.	Yes			82	81-90	1	0	0.0	0
1550198231996551169	بايدن أخذ جرعتي لقاح +جرعتين منشطة (حسب الرواية الرسمية) ومع ذلك أصيب بكورونا، وغيره كثيرون يقول خبراء الصحة العالمية أن اللقاح لا يحمي من الإصابة لكن يُخفّف الأعراض، وهذا يشبه -في كثير من الوجوه- أن يُقال لسيدة إن حبوب منع الحمل لا تمنع الحمل، بل تُخفّف آلام الحمل والولادة ..	Yes			277	100+	1	0	0.0	0
1406066638894604288	  يقول طبيب المسالك البولية في مقاطعة بالم بيتش بولاية فلوريدا إن لقاحات Covid-19 تسبب ارتفاعًا مقلقًا في العقم وسرطان البروستاتا لدى الرجال الذين تم تطعيمهم.	Yes			158	100+	1	0	0.0	0
1481368162314731526	هذا الشاب عمره ٢٦ سنة توفى من التطعيم والسلطات النيوزلندية اعترفت وربطت وذكرت في شهادة وفاته بأن وفاته بسبب تطعيم فايزر .. #لا_للتطعيم_الاجباري	Yes	لا_للتطعيم_الاجباري		143	100+	1	1	0.0	4
1479428196676349953	همام عقيل أراد أن يحث الناس على أخذ لقاح الانفلونزا مع الجرعة الثالثة من لقاح كوفيد فأقام الحجة على نفسه وعلى كل المناديب حيث أقر أن الانفلونزا أخطر من كورونا أيها الفذ مادام كورونا أضعف فيجب أن نتعامل معه دون لقاح كما كنا نفعل دائما مع الانفلونزا وهي أخطر أهدوا كلامه للمناديب	Yes			277	100+	1	0	0.0	0
1524379426347171840	"  هذه تعديلات جينية و ليست لقاحات استغرقت صناعتها أو طباعتها أقل من ثلاث ساعات، مازالت أتذكر شهادة ماجد العاني @<USER> حينما قال أن هذه اللقاحات""عبارة عن قواعد نتروجينية تم طباعتها في ساعات قليلة."	Yes		asad12q80	198	100+	1	0	0.0	0
1485312326614110208	الصحة: هناك مليون و 700 ألف في المملكة لم يحصلوا إلا على جرعة واحدة من لقاح كورونا.	Yes			83	81-90	1	0	0.0	0
1493727248813281281	اخر مقابلة للعالم لوك موناتييه، حاصل على جائزة نوبل لاكتشافه الايدز، ويقول انه لقاحات كوفيد تسبب الايدز. تم مسح المقابلة من الانترنت، ومسح دراسته. وتوفى بعد ٦ ايام من هذه المقابلة	Yes			179	100+	1	0	0.0	0
1487884595907502084	نحن في لحظة حرجة. لقاحات ال mRNA فاشلة تماما وبالاخص في اكثر دول العالم تلقيحا. وبالذات التعزيزية خطرها اكبر من نفعها ولا بد من سحبها من الاسواق. الموضوع خطير جدا ولا يحتمل التاخير. اللقاحات فاشلة تماما ضد اميكرون. هل من مزيد من المدافعين عن اللقاحات المقدسة صباح الخير بالليل	Yes			276	100+	1	0	0.0	0
1505265296596258830	  أثبت الغرب أنه بربري همجي يُكيّف المبادئ حسب مصلحته في موضعين هذا العقد: سطوه على المعدات الطبية والكمامات وتوز اللقاحات أثناء جائحة كورونا، حتى أن الدول الأوروبية أصبحت تسرق من بعضها البعض، ومصادرته أموال وممتلكات تجار ومستثمرين لمجرد حملهم للجنسية الروسية !	Yes			261	100+	1	0	0.0	0
1529126601895645185	الدكتور فاوتشي يتحدث عن سمية لقاح الجدري في مقابلة سابقة: لقاح الجدري له بعض الآثار الجانبية السامة النادرة ولكنها قد تكون خطيرة إذا كان عندك نقص بالمناعة فقد يكون مميتًا. و التهاب عضلة القلب مرتبط به. لقد قبلنا سمية لقاح الجدري لأن مرض الجدري كان موجود.   التكملة	Yes			266	100+	1	0	0.0	0
1523980045018091521	دراسة بريطانية جديدة تؤكد : الجرعة الرابعة من لقاح كورونا تمنح الأشخاص حماية أعلى من تلك التي توفرها الجرعات الثلاث، حيث ارتفعت مستويات الأجسام المضادة أعلى من المستويات التي شوهدت بعد الجرعة الثالثة. -	Yes			202	100+	1	0	0.0	0
1548964772724498433	  نيويورك: صف طويل لتلقي لقاح #جدري_القرود، الغالبية العظمى من الرجال بسبب انتشاره بين الشواذ .	Yes	جدري_القرود		95	91-100	1	1	0.0	0
1487731349008044034	لم يتوفى طفل واحد من مرض كورونا خلال سنتين من بداية الوباء قد تكون أضرار التطعيم على هذه الفئة تفوق الفوائد بكثير لذلك التمهيد لتطعيم هذه الفئة من الأطفال ما هو إلا عبث الوضع أصبح لا يطاق و تعدى مرحلة الوباء إلى مرحلة الغباء	Yes			224	100+	1	0	0.0	0
1480945532185059328	بفضل الله أكثر من (53,000,000) جرعة من لقاح كورونا (كوفيد-19) تم إعطائها حتى الآن في كافة مناطق المملكة.  #خذ_الخطوة خذ اللقاح وسجل الآن عبر تطبيق صحتي.  	Yes	خذ_الخطوة		154	100+	1	1	0.0	2
1488055788602109955	علماء في نيوزلندا يكتشفون أجسام مثيرة للجدل داخل لقاحات فايزر متناهية الصغر بحجم جزيئ النانو لالمون ماذا تكون بالضبط!	Yes			117	100+	1	0	0.0	0
1485218750597111812	استمرار القيود على غير المحصنين ودوام سلسلة التطعيمات دون استراتيجية حقيقية وفرض اجراءات على حرية السفر أمور يجب مناقشتها بجدية مع الحكومة .. لذلك سأتقدم غداً صباحاً ومجموعة من الزملاء بطلب جلسة خاصة الأحد القادم للمناقشة ووضع الحلول لرفع هذه القيود.	No			250	100+	0	0	0.0	0
1482340884498759686	إلزامية التطعيم للطفل تعني تعريض الأب للمساءلة القانونية في حال أمتنع عن تطعيم طفله باللقاح المقرر! ندرك جيداً مانحن مقبلون عليه لذلك إن لم نقف جماً وقفة جادة لمقاطعة التعليم ومنع الأطفال من الحضور ستكون الأقلية فريسة سهله جداً #تحصين_بدون_موافقة_الآباء #غياب_جماعي_للابتدايي	Yes	تحصين_بدون_موافقة_الآباء غياب_جماعي_للابتدايي		275	100+	1	2	0.0	4
1479165876960210946	#توعية ||  الالتزام بالإجراءات الاحترازية والتدابير الوقائية يساعدنا جماً في الحد من انتشار #فيروس_كورونا. #نتعاون_مانتهاون #المدينة_المنورة	No	توعية فيروس_كورونا نتعاون_مانتهاون المدينة_المنورة		140	100+	0	4	0.0	0
1221153969260711936	"1. بمناسبة حملة"" كورونا،أود أن اغرد قليلاً عن علاقة الخوف والضغط النفسي بالصحة والمناعة. لا أريد أن أتحدث عن الناحية الطبية لهذا الفيروس،فالتايملاينات (جمع تايملاين) جعلت الموضوع حديث الساعة!ولا أريد التحدث عن الوقاية الكلاسيكية بالتطعيم، بل أود التحدث عن العلاقة المباشرة للخوف"""	No			281	100+	0	0	0.0	0
1485196633478418432	"حذر خبير المناعة واللقاحات الدكتور غيرت فاندن بوش من تطعيم الأطفال ووصفه بالعمل الإجرامي"" فلا تستمعون للمجرمون الذين يحرضونكم لتطعيم أطفالكم فلا أحد يضمن لك حياة طفلك ولن يتكفل بعلاجه لا سمح الله إن أصيب بعارض وأستدعى علاجه إلا أنت وحدك #أطفالنا_خط_أحمر #لا_للتطعيم_الاجبار"	Yes	أطفالنا_خط_أحمر لا_للتطعيم_الاجبار		275	100+	1	2	0.0	0
1477070434327801862	أصابني وعائلتي فيروس كورونا خلال الأيام القليلة الماضية ، وبفضل الله نجونا منه ، و عليه أنصح الجم ، اللقاح مهم جداً ، وله دور كبير بعد فضل الله بتخفيف الآثار الجانبية للفيروس ، فلا تترددوا بأخذه بارك الله بكم .	Yes			210	100+	1	0	0.0	0
1487997070493552643	شبكة CBC الكندية: نقل رئيس وزراء #كندا، جاستن ترودو، وعائلته إلى مكان سري وسط مخاوف أمنية عليهم، حيث يتدفق الآلاف من سائقي الشاحنات إلى العاصمة أوتاوا للاحتجاج ضد الإجبار على تلقي لقاح #كورونا. #TruckersForFreedom2022	Yes	كندا كورونا TruckersForFreedom2022		217	100+	1	3	0.0	2
1484956152073015302	الدول التالية أعلنت إلغاء جم إجراءات الحجر واختبارات كورونا واللقاح الإجباري ، واعتبار كورونا مجرد إنفلونزا موسمية : ١) تركيا   ٢) البرازيل   ٣) بريطانيا   ٤) السويد   ٥) إسبانيا   ٦) التشيك   ٧) المكسيك   ٨) السلفادور   ٩) اليابان   ١٠) سنغافورة   الكويت  	Yes			257	100+	1	0	0.0	0
