tweet_id	tweet_text	class_label	hashtags	mentions	text_length	text_length_category	class_label_encoded	hashtags_frequency	hashtags_sentiment	hashtags_topics
1351233726852771843	@<USER> Boeie gezonde jonge mensen hebben GEEN las van di virus. Hoogs ens ziek op de bank ech er is di ook meer ui zondering dan regel.	Yes		MarcelHeins hsbs70195150 NLfees rivm	136	100+	1	0	0.0	0
1351239498605223939	In erview @<USER> urkerland over # huisonderwijs & #leerkrach zijn. Fan as isch hoe #leerlingen hun werk oppakken, # ro s op alle #ouders die keihard hun bes doen om #onderwijs ad #keuken afel vorm e geven. Ik geloof da iedereen s raks precies erech kom waar ze moe en zijn..coLQm0XncEBV	No	leerkrach leerlingen ouders onderwijs keuken	he	287	100+	0	5	0.0	1
1351240605129723906	"Lees ""Vrouw van 108 jaar gevaccineerd in I ali ""op Nieuwsblik -.cosHJoBB3cUX - Een I aliaanse vrouw van 108 jaar heef een coronavaccin oegediend gekregen, erwijl ze al een besme ing me he gevreesde virus..."	Yes			206	100+	1	0	0.0	0
1351485411844096001	@<USER> Ik volg slech s de re oriek die ik op s eeds meer plekken egenkom over coronapaspoor en e.d.	No		mark_segunda sil_ver_sur_fer	100	91-100	0	0	0.0	0
1351533045204082689	"@<USER> @ achless2 Jullie berich en raken mij He lijk wel of iedereen s eeds meer van elkaar vervreemd door ""Corona"". He gaa voor mijn gevoel al heel lang nie meer om - we doen he samen -"	No		anseke	187	100+	0	0	0.0	0
1351533860182511617	De malafide handel in honden neem schrikbarend oe.Binnen- en bui enlandse malafide fokkers en handelaren zorgen sinds de coronacrisis voor ex ra veel jonge hondjes. TE jong weggehaald bij hun moeder, wa leid gedragsproblemen #vleu erweide #demeern.coglzd2uHmkG	Yes	vleu demeern		260	100+	1	2	0.0	0
1351806448389468162	@<USER> Hahahaha... Heef er al iemand ui gelegd da Denemarken geen buurland is. (onderzees dan nog?) Waarom geen onderzeese me I ali ? Trouwens, via Dui sland is er al een verbinding.. En ussen D en B is er al een HV-connec ie. Maar bon, zo kom een mens nog eens in de kran.	Yes		demorgen	274	100+	1	0	0.0	0
1351814151941877760	Alber Heijn vergroo mark aandeel in coronajaar 2020 | Nederlands Dagblad @<USER>.coC2HyKDDaok	No		AholdDelhaize	93	91-100	0	0	0.0	0
1351824832191750147	Terwijl he kabine bezig is me onbelangrijke dingen als de #avondklok blijf he ech belangrijke liggen: zoals de schade van PFAS voor de mens, lees verder bij he @<USER> Tip: la en we de aarde redden, dan kunnen er mensen op leven.coaOxvXarwO1	Yes	avondklok	rivm	241	100+	1	1	0.0	3
1351881294347644928	En ze gaan nog verder me beperkende maa regelen me deze keer een #avondklok, bezoekbeperkingen en quaran aineplich. @ The rumanconferen ie # he rumanshow #persconferen ie #Ru e #DeJonge	No	avondklok persconferen Ru DeJonge		185	100+	0	4	0.0	3
1351885524215197699	"@ hierrybaude een ar ikel me als kop : ""is Covid-19 een hype""is misschien wel kwe send voor degenen die een geliefde aan deze 'hype' hebben verloren? Dus gewoon egen he beleid van he bedrijf LinkedIn en daarom hebben ze alle rech om he berich e verwijderen."	Yes			257	100+	1	0	0.0	0
1351885835294138375	Nog s rengere coronamaa regelen: de regels op een rij je -.coA0giSTJScu.co oK742Xxo8	No			84	81-90	0	0	0.0	0
1351886577346215937	ech ve om journalis e zijn en bij een persconferen ie e gaan zi en en dan nie e luis eren naar wa er gezegd word	No			112	100+	0	0	0.0	0
1352208465842876416	van haga - ga fie sen! me je *s evige griep*- #coronadeba	No	coronadeba		57	51-60	0	1	0.0	2
1352319409948393473	Po sierlijk, di gespeelde verze van #D66 egen de #avondklok samen me de opposi ie, erwijl ze di als coali iepar ner gewoon in ern had kunnen bespreken. Iedereen wee da deze coronamaa regel onon koombaar is, zelfs de @<USER> erban. #eenvandaag.coKzWAuN3AVy	Yes	D66 avondklok eenvandaag	D66	255	100+	1	3	0.0	3
1352321702789832704	@<USER> enGwendolyn.coOfeKmBzIBQ moe je eens bekijken, di werk ech en dankzij Corona meer wins en ook !	Yes		ingridvermeule6 Ru	103	100+	1	0	0.0	0
1352487662008074241	@<USER> En in de zomer nie ?	No		CoronaDirec	28	21-30	0	0	0.0	0
1352490226036461570	Wie is er allemaal egen 2 weekjes #avondklok en waarom? Change my mind. Noo : ik zi al 11 maanden in huisarres dus je moe van goeie huize komen. #coronamaa regelen.co465 oC0xlA	No	avondklok coronamaa		176	100+	0	2	0.0	1
1352592161175437313	Deze landen mogen vanaf nu #kernwapens nie meer bezi en, inze en of dreigen me gebruik. He on wikkelen, es en, produceren, vervaardigen, verwerven of opslaan is ook verboden, ne als ze e la en s a ioneren op of in e ze en door anderen vanaf he eigen grondgebied.	No	kernwapens		262	100+	0	1	0.0	0
1352600164511440897	@<USER> Da laa s e vind ik ook, laa da duidelik zijn. Ik vind - zeker op di momen in corona ijden - he overkill. Zeker in de JPL zie je soms drama ische ma chen, maar algemeen is er gewoon eveel voe bal op v.	No		_daderij	208	100+	0	0	0.0	0
1352623738714546183	Mijn eigen muziekhoek gecre erd op zolder. He kan oor je word laa s e ijd gro endeels door mijn manneke benu voor he huiswerken i.v.m de coronamaa regelen. #Ins a # wee s #cornerofmyhome #music #Corona #coronamaa regelen #ui gevenineigenbeheer # ijdrovend.co71aeBXMOHq	No	Ins cornerofmyhome music Corona coronamaa ui		268	100+	0	6	0.0	3
1352695635678539776	Wa hebben mensen aan di soor berich en? Bange mensen nog meer angs aanjagen? #coronavirus.coD2RFG63pr9	No	coronavirus		102	100+	0	1	0.0	4
1352741765275676673	"POLL: ""Tijdens de avondklok ga ik gewoon naar bui en.""#avondklokdeba #avondklok #coronacrisis #coronavirus #lockdown2021"	No	avondklokdeba avondklok coronacrisis coronavirus lockdown2021		120	100+	0	5	0.0	3
1352885030650056710	"Jongeren lopen door de coronabeperkingen vaker rond me plannen voor #zelfdoding, zo blijk ui cijfers van @<USER> ie. ,Oorzaak zou kunnen zijn da er heel veel is weggevallen, zoals he sociale leven, de dags ruc uur."""".coY3JiO2eluX"	Yes	zelfdoding	113preven	229	100+	1	1	0.0	0
1352983934150332416	Corona bes aa nie Joos. Al hans da denk een redelijk deel van de Nederlandse koekoek complo denkers en gele hesjes delega ies. #avondklokpro es	No	avondklokpro		143	100+	0	1	0.0	0
1353041619545632770	Onbekende Oos endenaar @<USER> ommelein smeek @<USER> om de #kappers e heropenen #coronamaa regelen live op #v mnieuws (sleeuw Bar ).coOgQsabjVsQ	No	kappers coronamaa v	Bar alexanderdecroo	145	100+	0	3	0.0	1
1353050042148352000	"@<USER> erKlivia2 @<USER> ""Je heb wel een gro e mond voor iemand die ne haar diploma heef ""Ja...? ""Ik ben iedere dag ( me collega's ) in de weer me bewoners. Sommige collega's nog nie hers eld...en jullie blijven er rich lijnen @<USER> s aan...en die kloppen gewoon nie. #ffp2. #IkZieHe Wel"	Yes	ffp2 IkZieHe	Zus NieuweUnie91 rivm	290	100+	1	2	0.0	4
1353051421499940864	AVONDKLOK IN NEDERLAND Meld je aan vanavond na 21.00 uur ! Veilig In gevaar #AvondklokPro es #lockdown2021 #coronamaa regelen	No	AvondklokPro lockdown2021 coronamaa		125	100+	0	3	0.0	0
1353101432866615297	Er is nog veel meer dan de CORONAVIRUS. Er zijn nog 8000 andere ziek es, waar dagelijks mensen aan s erven! ------ #AvondklokPro es #avondklokdeba #avondklokshow #avondklok #coronamaa regelen #COVID19NL #CodeOranje #Belgie #Nederland #CoronaCrisis #coronabeleid #coronavaccin.co1 lxqcP0YR	Yes	AvondklokPro avondklokdeba avondklokshow avondklok coronamaa COVID19NL CodeOranje Belgie Nederland CoronaCrisis coronabeleid coronavaccin		288	100+	1	12	0.0	1
1353108525875126272	@<USER> Die discussie en ui koms ken ik nie maar ik wee wel da he medisch e hische al ijd een speerpun was voor D66. Dus waarom ze de hele corona pandemie zo oorverdovend s il zijn begrijp ik nie. D66 zweeg en keek weg oen ouderen en kwe sbaren nie als eers e werden gevaccineerd	Yes		BoonAdriana	279	100+	1	0	0.0	0
1353109132094689280	En nu ik och op gang ben, groo respec voor de handhavers! In Ams erdam doen zij een hell of a job gedurende de corona crisis. Handen af van de poli ie. #avondklok.cojgrIY6KUUn	No	avondklok		175	100+	0	1	0.0	3
1353110886475509761	@<USER> nee da help nie die avondklok en die corona is ie s wa Ru e hard opblaas	Yes		BasFilippini vrijensociaal	80	71-80	1	0	0.0	0
1353140478359842818	Wee je nog oen ik zei da di he jaar ging zijn waarin ik eindelijk de s ap ze e om me eindelijk e doen es en op ADHD enof dergelijke? Vanavond had ik he even la en vallen...	No			172	100+	0	0	0.0	0
1353594581804318721	Yes, we zijn voor he 9e jaar op rij #TopEmployer! Me resul a en ondanks de coronacrisis. Jan Heyvaer , onze HR-direc eur, blik erug op de s ra egie er di succes:.comySUHriKTZ #nwow #wellbeinga work #humanresources #fu ureofwork #learning #employeeexperience.coeZ1WAFm lU	Yes	TopEmployer nwow wellbeinga humanresources fu learning employeeexperience		270	100+	1	7	0.0	0
1353617194157035522	"GGD begin dinsdag me vaccina ie van huiswonende negen igplussers.co R5ZyLQwka via @<USER> zo geen coronavirus maar wel mogelijk andere akelige ziek e ""demen ie "", af akking ""e hische dilemma""s"	Yes		NUnl	192	100+	1	0	0.0	0
1353619881254649856	@<USER> Maar da is idd ook he hele nare van corona, sommige worden heel ziek en andere hebben geen of weinig klach en en van e voren kun je nie we en of je er erg ziek van word of nie. Ik wil je wel nog even veel succes wensen me revalideren!	No		J0shi76	242	100+	0	0	0.0	0
1353704260232507392	@<USER> ijn @ hierrybaude TTI En da is nu ne waar Baude (FvD) wel voor plei e in maar 2020. Nee Zealand deed he wel, 25 Covid-19 s erfgevallen en 2.288 besme ingen sinds de ui braak. NZ heef wel een Me ropool s ad..coYJkVQHDd4o	Yes		MeijerMar	227	100+	1	0	0.0	0
1353787539237302272	@<USER> a74133402 @<USER> @ hierrybaude Ik ken veel oudere die corona gehad hebben (me ouders buren collega's, leraren ) niemand werd dood ziek... Zelfde s rekking: omda wij ze nie kennen wil nie zeggen da he nie erg is...	Yes		Rie OudMaar WybrenvanHaga	222	100+	1	0	0.0	0
1353952454367457281	Heb langzamerhand wel de indruk da er een laag hardwerkende ( op) amb enaren is , die in een oude wereld leven. Wa een SARSCov2 gepru s: - con rac en vaccins - infras ruc uur & organisa ie regis ra ies - rou ekaar en, corona dashborden me s uurloze info - geen beslissingen	No			273	100+	0	0	0.0	0
1354071947278233603	Minder dan 4000 nieuwe coronagevallen, voor he eers sinds 24 november (bron: RIVM).coyAI4MOBBJV.coDP9oBDggRQ	Yes			108	100+	1	0	0.0	0
1354077367375978497	"11 nieuwe #COVID19 posi ief ge es e inwoners van #Bunscho en Ook word er een ziekenhuisopname gemeld. En de afgelopen 7 dagen zijn er nu 69 besme ingen""gemeld, da zijn er 314 op de honderdduizend..coVRu8gy48gM"	No	COVID19 Bunscho		209	100+	0	2	0.0	2
1354213258752831489	"#corona #hugodejongekanniks #wappies Hugo is complo wappie. ""in de vorm van een samenzwering"".co5vCsFUjYSQ"	Yes	corona hugodejongekanniks wappies		106	100+	1	3	0.0	3
1354326078148513793	@<USER> Volgens mij is he corona maa regelen demons ran en en geen corona demons ran en.	No		EenVandaag	88	81-90	0	0	0.0	0
1354379810517221377	@<USER> iekBIJ1 Alvas een s ukje inpu : de overheid loop op alle fron en er me he oegankelijk maken van websi es en apps. Zo is de corona-informa ie van GGDs, veiligheidsregio's en gemeen es nauwelijks oegankelijk voor visueel beperk en. +- 85% van de visueel beperk en be ref ouderen	Yes		SylvanaBIJ1 YuvalGal8 everdienvd Poli	284	100+	1	0	0.0	0
1354381120310288385	He gro e nadeel van een huiswerkende man die in een videomee ing zi : ik kan hem hier beneden ne nie vers aan, en och blijf mijn hoofd da s eeds proberen en raak ik daar giga overprikkeld van.	No			192	100+	0	0	0.0	0
1354949005554290690	@<USER> en @<USER> @ hierrybaude @<USER> aaij @<USER> Deze kan je de eers e vier of vijf dagen na de besme ing onders eunen me : ivermec ine, een zink-injec or zoals hydroxychloroquine, veel elemen air zink, een an ibio icum, vi amine C, vi amine D, selenium. Di is be er dan die halfbakken mRNA-flauwekul.	Yes		blckbxnews hugodejonge MinPres RobJe SigridKaag WybrenvanHaga keesvds rivm RIVM_vDissel	306	100+	1	0	0.0	0
1354951114286886912	Hoe kan he aan al zieke Covid-19 geinfec eerden zo snel s ijgen als er massaal is gevaccineerd? Helpen de vaccins nie of veroorzaken ze juis Covid-19?	No			150	100+	0	0	0.0	0
1355062409644429312	@<USER> erdam @<USER> Een laa s e poging: ja, de vraag s aa erop maar er gebeur nie s me he an woord! Als he an woord ja is, dan is he aanbevolen om de bloedverdunners ruim 4 uur voor of na de vaccina ie in e nemen. Di advies, gehan eerd in verpleeghuizen, zie ik nergens erug.	Yes		GGDGHORNL rivm GGDAms Rijksoverheid	277	100+	1	0	0.0	0
1355207367386947587	@<USER> Hoop da die wappies he krijgen dan lullen ze nie zo ui hun domme kop de mens leer he nooi en never	No		Helena8018 rivm	106	100+	0	0	0.0	0
1355211883440189448	@<USER> Wassing ja lekker al da labellen van mensen, reclame, es en, adver en ie, laa je nie kenne gekkie... en da lever dan meer oplages op van Ad?	No		JornLuka Brigi	148	100+	0	0	0.0	0
1355244060609417219	@<USER> er erHors Hier wach een Nobelprijs voor Coronacrea ivi ei	No		Pe	65	61-70	0	0	0.0	0
1355247961974992897	#nosjournaal #op1 #r lnieuws #r lboulevard #jinek # weedekamer #kabine #rivm cancelled me een al vluch en afkoms ig van #Brazili incl. de ussenwanden.Of gaan we weer laconiek doen zoals me de Bri se en Chinese virus.coYxYysShq5m	No	nosjournaal op1 r r jinek kabine rivm Brazilië		228	100+	0	8	0.0	1
1355431260253024257	@<USER> Wierenga2 @<USER> amburski @<USER> Da is allemaal bekend. Rivm concludeer ech er da LFG meegenomen is in huidige norm en bij windenergie geen groo probleem is.	Yes		Ber s mayaVirg	167	100+	1	0	0.0	0
1355455256839249921	De wappies wis en he zeker; di was een door Ru e be aalde hooligan. Blij om he ech e verhaal e horen en fijn da onze rech ers clemen me si ua ies omgaan. #corona #rellen # ro sopnederland #erisgeencomplo.cobFOu6NGSQ2	Yes	corona rellen erisgeencomplo		216	100+	1	3	0.0	3
1355548001473847298	Bayern M nchen gooi Tolisso ui weds rijdselec ie: Fransman over rad coronamaa regelen.coPzzgw1cVYE #bayhof #bayernmunchen #hoffenheim	No	bayhof bayernmunchen hoffenheim		133	100+	0	3	0.0	0
1355564636226117633	Bes e @<USER> afgelopen week is in I ali de VS en Belgi vas ges eld da zelfs kinderen &l ;5j me verschijnselen besme elijker zijn dan volwassenen. Scholen veilig open? Alleen me FFP2 voor docen en ouders en leerkrach en...	Yes		Paul_van_Meenen	222	100+	1	0	0.0	0
1355926283948077064	@<USER> In s eeds meer landen pikken de mensen de absurdi ei van de maa regelen die door de regeringen worden genomen. Me name de lange duur daarvan. Zo kan je nie blijven doorgaan. Mensen snakken naar vrijheid. We zullen er mee moe en leren leven da er Corona bes aa. Maar wel vrij.	Yes		SBergsma	283	100+	1	0	0.0	0
1355927933911756802	Eigenlijk vind ik da de leraren dan eers een vaccin moe en hebben gekregen alvorens je ze voor de leeuwen gooi. En is er al ui slui sel ui al he we enschappelijk onderzoek naar he gevaar voor kinderen, de diverse mu a ies en de verspreiding? #scholendich	No	scholendich		254	100+	0	1	0.0	1
1355935472732827652	De bui enschoolse opvang gaa nog nie open, omda daar kinderen van verschillende scholen komen. En zo zei minis er Slob ook bij de ex ra maa regelen: als er in een klas een kind is me corona, dan moe de hele klas vijf dagen in quaran aine.	No			238	100+	0	0	0.0	0
1333862750523625473	@<USER> evanbolhu En ik maar denken da da mondkapje bedoel was om corona e s oppen. Hoe dom van mij. He gaa er om da je kun la en zien hoe goed je ben , da je gu mensch ben , en aan anderen denk. Na uurlijk. Da ik da nie zag..coCJYsxheArO	No		anne	238	100+	0	0	0.0	0
1334130804147019776	@<USER> @ hierrybaude Ja klop , maar hun lijn van corona is al ne zo slim. Die kijken dus ook nie naar de werkelijke cijfers. Te gevoelig ze worden zo meegesleep. De cijfers nog s eeds onder de griep.	Yes		CrouchingHidden WNLVandaag	200	100+	1	0	0.0	0
1334133283312037891	@<USER> Kruijswijk @<USER> alle2 @ elegraaf @<USER> Ik zeg ook nie da er geen virus is, alleen is da nie nieuw. Corona virussen hebben we al vanaf de 60er jaren onder de loep, waren onderdeel van he 'griepseizoen' di jaar... En, virussen mu eren al zolang de mens bes aa. Di is zwaar bui enpropor ionele paniekzaaierij.	Yes		Ber Geloofnie NOS	319	100+	1	0	0.0	0
1334398013050146816	FYI De da amanipula ies van he RIVM - Maurice de Hond.coRmTJQ38uwR	Yes			66	61-70	1	0	0.0	0
1334410573145124865	@<USER> Kan ine? Die is bij ons al even geslo en hoor vanwege corona. Thuis een bamme je zeg ik.	No		FD_Nieuws	96	91-100	0	0	0.0	0
1334411219965534209	@<USER> 1 Rivm is nie onafhankelijk. Da heef de coronacrisis wel bewezen. Ook he fei da een onderzoek naar werkwijze van RIVM geleid moes worden door de oud direc eur van he RIVM werk nie mee aan ransparan ie en onafhankelijkheid bewijzen van he RIVM.	Yes		Moonnie jon_doordach chriszeeven LeonAdegees	251	100+	1	0	0.0	0
1334520452123926539	De in egra ie van s a ushouders en asielzoekers s ok door corona en de vereenzaming neem oe. Ui onderzoek blijk da he aan al con ac en me de helf is gedaald..co9oOF1nSBVw	No			170	100+	0	0	0.0	0
1334523109391654912	"Lees ""Facebook gaa onjuis e beweringen over coronavaccins verwijderen""op Nieuwsblik -.coc9Lxn8Uc13 - Facebook gaa onjuis e beweringen over coronavaccins verwijderen van Facebook en Ins agram. Volgens he bedrijf kan verkeerde informa ie..."	No			238	100+	0	0	0.0	0
1335604813086793729	@<USER> he val me op da de media egenwoordig he RIVM ci eer in de koppen. Er was och afgesproken da we nie meer zouden spreken van besme ingen? Hoe zi da ?	No		NOS rivm	155	100+	0	0	0.0	0
1335953318686978056	"Kinder- en Jeugdpsycholoog Josien Groo van he Onders eunende en Pallia ieve eam @<USER> bied onders euning aan gezinnen me een erns ig zieke ouder. Da kan gaan om een ouder me kanker of opgenomen op de har afdeling, In ensive Care of op een cohor -afdeling vanwege corona"""	No		OLVG	272	100+	0	0	0.0	0
1335954689964257282	"Een dag voorda he kabine weer nieuwe coronamaa regelen bekend maak , voer de KNVB ac ie voor he ama eurvoe bal. Op he Malieveld in Den Haag liggen daarom sinds maandagoch end zo""n duizend shir s die he woord STIL""vormen..cof5cWHAGhL0"	No			233	100+	0	0	0.0	0
1336012347434000385	@<USER> enman1 @<USER> s Hieronder klein s ukje van de ins ruc ies voor Vaccina ie in de UK van he nieuwe Covid-19 vaccin. Officieel is di geen vaccin maar een s ukje gene ische code... Waarom moe he anders bij - 80 bewaard worden en is max 6 maanden houdbaar?.coZE8YezAp7O	Yes		Wi georgevanhou	273	100+	1	0	0.0	0
1336254297940643842	He mascne is ech en je handen drogen onwijs ui van he overma ig desinfec eren. @<USER> heef daarom een box vol produc en die ons beschermen egen de schadelijke elemen en van de coronamaa regelen. #persconferen ie #covid19nl #COVID19 #Nederland.coq9YZebXWcV	Yes	persconferen covid19nl COVID19 Nederland	Aveneusa	256	100+	1	4	0.0	1
1336260243815325696	@<USER> gervdNoor Voor mensen die gein eresseerd zijn kijk even op @<USER> nikvaccine een vd voornaams e usp's is evens da di Covid-19 Spu nik V Vaccin vervoerd en opgeslagen kan worden ussen 2-8 graden en waarom ook di vaccin nie la en es en bij EMA er is nu al een giga ekor aan vaccins.	No		Ru spu	289	100+	0	0	0.0	0
1336385164906295297	Baby in Singapore geboren me an is offen voor coronavirus.co5Chm8dMnQ8.coUqlo RvGfk	Yes			83	81-90	1	0	0.0	0
1336391023803691010	@<USER> je2010 Zi in he zelfde schui je he houd nie op.Hier in Nederland van de zomer dikke paniek in Hongarije waar ik was bes ond nie eens corona daar za en we allemaal gezellig in een res auran en in de kroeg. We worden in de maling genomen.	Yes		Aspers16 saar	244	100+	1	0	0.0	0
1336394079782006795	#persconferen ie #enigeffec - Mondkapje heef enig effec - 1.5 me er heef enig effec - Nie knuffelen heef enig effec - Langzamer ademen heef enig effec - Binnen blijven heef enig effec - Je oma nie meer bezoeken heef enig effec - Nie nadenken heef enig effec	No	persconferen enigeffec		257	100+	0	2	0.0	3
1336941354031714304	CSV Apeldoorn vind kans op verspreiding coronavirus e groo en slui deuren spor park - De S en or.coDNh83JOgPD via @<USER>	No		GoogleNews	121	100+	0	0	0.0	0
1337025529002815488	"Genkse poli ie schakel drones me warm ecamera""s in voor handhaving coronaregels.co8YmPbdVjqz"	Yes			92	91-100	1	0	0.0	0
1337030658707906560	Flinke s ijging: RIVM meld 8793 nieuwe coronabesme ingen.coBwAsnvxQFz	No			69	61-70	0	0	0.0	0
1337032081185140740	Aan al coronapa i n en in ziekenhuizen ie s gedaald.co5s5XHy3pvv	No			64	61-70	0	0	0.0	0
1337480144500428803	@<USER> Er kom dead ass een film ui over corona	No		demigad5	47	41-50	0	0	0.0	0
1337673772204232705	IGJ: opnieuw verpak e corona es minder be rouwbaar.coHlFd1rcCmP	Yes			63	61-70	1	0	0.0	0
1337678239678992384	@<USER> albers @ ijd Die drones waren er al, vingerafdruk op e id, camera's s onden er ook al voor corona, de mili airen op s raa , @<USER> plei e voor woons be reding bij vermoeden,... heef niks me corona e maken.	No		i de_NVA	214	100+	0	0	0.0	0
1337743578563551233	@<USER> @ hierrybaude @<USER> 'Complo - heorieen' 1: Er kom een 'Big rese ', geholpen door de bewus opgeklop e Coronacrisis (check) 2: Nie -gevaccineerden gemarginaliseerd (check) 3: In 2016 zorgde de griepgolf voor volle IC's, erwijl er wee keer zoveel bedden waren (check). Zijn geen heorieen meer hoor.	Yes		TijsvandenBrink eovisie	305	100+	1	0	0.0	0
1337828109580693505	@<USER> Ik vind da helemaal geen rare ui spraak. Hij zei er juis bij da hij nie wee hoe lang iemand immuun blijf. He RIVM krijg con inu cijfers van Sanquin en he RIVM doe zelf ook onderzoek. Eind nov za en we al op ruim 8%, dus kans is groo da nu inderdaad op 11-12% zi en.	Yes		1philosophizer ginnymooy	273	100+	1	0	0.0	0
1338040926820823040	@<USER> erkeller klop idd he hele corona verhaal is een gro e afleiding om he omvolkingsprogramma e la en plaa svinden	Yes		Anaw_Llullay wou	118	100+	1	0	0.0	0
1338044909375381504	@<USER> Dinsdag persconferen ie? Dring he eindeijk door? Veel mensen och naar Zwi serland me code oranje. Herhaling van maar dus. Ze moe en dan quaran aine maar verplich maken. Zag op TV hoe ze daar hu je bij mu je za en. Alles is gewoon open. Economie boven alles	No		hugodejonge	264	100+	0	0	0.0	0
1338109900396892160	@<USER> 100 jaar ONDERZOEK naar oorzaak #kanker heef geen resul aa op geleverd. 10 maanden ONDERZOEK naar oorzaak #covid-19 heef , resul aa opgeleverd. Is he veilig ? #coronavirus #ic	Yes	kanker covid coronavirus ic	Ik93677087 beau	183	100+	1	4	0.0	4
1338131706533056512	Correc ie: Lockdown in NL al vanaf dinsdag Persconferen ie op maandag	No			69	61-70	0	0	0.0	0
1338152998934077441	@<USER> En enzij je genoeg virus in je afscheidingen (hoes en, niezen, e c) heb , is he onwaarschijnlijk da je iemand infec eer. Maar als je een besme elijke virus cul uur in je luch wegen heb , zul je symp oma isch zijn. 22	Yes		boorveen madjo Karin_vanlonden rivm	224	100+	1	0	0.0	0
1338235731706327040	Jus i ie waarschuw voor neplijs rond coronamaa regelen op social media.coZKb8OFdKru	No			83	81-90	0	0	0.0	0
1338578928148111360	Oepsie: 'E n op de 800 Nederlanders gewond in he verkeer afgelopen jaar.' Van Egmond bedoelde na uurlijk 800 Nederlanders. #vragen #coronavirus	Yes	vragen coronavirus		143	100+	1	2	0.0	4
1338597034044043267	@<USER> Kom op Thomas, Gemiddeld liggen er 1,2 personen op de IC per ziekenhuis. Da is och geen reden? Tijdens#Ru eII hebben de @<USER> me @<USER> e en de @<USER> me @<USER> de hele zorg om zeep geholpen. Van maar nu is er NIETS gebeurd #Corona #coronamaa regelen	No	Ru Corona coronamaa	Thomasvanluyn VVD markru PvdA LodewijkA	263	100+	0	3	0.0	3
1338622480676696069	@<USER> wa lig nie aan scholen? Je zie percen age mogelijk besme op school veel e hoog is, s ukken lager dan percen age is horeca des ijds. En via school kom he huis, werk en spor scholen... wa een #fail ui spraak #covid19nl #coronamaa regelen # oespraak #op1	Yes	fail covid19nl coronamaa op1	arieslob	259	100+	1	4	-0.125	1
1338986926490128387	Corona-commissie: Zweden is er nie in geslaagd oudere inwoners e beschermen.	Yes			76	71-80	1	0	0.0	0
1339257480422051843	Meer mensen bereid inen ing egen coronavirus.coUrUk3Sprec	No			57	51-60	0	0	0.0	0
1339260867565805573	He #kabine en de gemeen e #Nijmegen zijn #nonac ief.a.v. he es en. #1V.coaSE5wfZqqq	Yes	kabine Nijmegen nonac 1V		85	81-90	1	4	0.0	2
1339265207215026178	@<USER> AndTex @<USER> ers all Omda men verder kijk dan alleen mor ali ei , maar juis ook naar morbidi ei ; de ziek elas. De druk op de zorg is me COVID-19 veel hoger dan bij een reguliere griep.	Yes		Ney eddy_	195	100+	1	0	0.0	0
1339331539390373892	@<USER> Geluk? Er zijn er simpelweg geen 'honderdduizenden' die deze complo #viruswaanzin delen. Zo simpel is he gelukkig. Prima om e pro es eren, maar dan wel volgens de regels. Di sloeg nergens op en was nie aangekondigd zoals de demons ra ie regelgeving voorschrijf. #coronavirus	Yes	viruswaanzin coronavirus	Bonny16939529 MinPres	282	100+	1	2	0.0	4
1339456848076943361	@ erzake v @<USER> S even de vr is coronaproof. Ok dan. pffff.co4yaf3xXLpO	No		VanGuch	74	71-80	0	0	0.0	0
1339523627763392516	Jouw vragen in 'Coronavirus: fei en en fabels', bekijk he hier erug - NOS: Te gas waren onder anderen minis er De Jonge van Volksgezondheid. Voor medische vragen waren epidemioloog Pa ricia Bruijning en immunoloog Marjolein van Egmond aanwezig..cof2IB0 aR17.cok0FQ2JqGK4	No			270	100+	0	0	0.0	0
1340276464445501442	"Pas bij de 1e gevallen in Dui sland, eind februari, werd duidelijk da in China de milde gevallen waren gemis en drong bij mij he besef ech door da di een pandemie zou kunnen worden...En da he zich verspreidde als een gewone verkoudheid. Sluipend dus.""#CoronaCrisis 510"	Yes	CoronaCrisis		268	100+	1	1	0.0	0
1340303148280389635	@<USER> erdammer je Di val nog e doen, maar in he vlieg uig ben je na uurlijk de klos. Honderden mensen op elkaar gepak , ven ila ie me hepafil er (zelfde als koffiefil er) die he #coronavirus door he oes el blaas. Me Corona Express Airways naar Playa del Corona..co2X9AkIKC2I.coZfLfj8deJ3	Yes	coronavirus	Ro	289	100+	1	1	0.0	4
