tweet_id	tweet_text	class_label	hashtags	mentions	text_length	text_length_category	class_label_encoded	hashtags_frequency	hashtags_sentiment	hashtags_topics
37436	He's been a professor for a long time at a great school.	No	[]	[]	positive	11-20	0	0	0.0	0
37440	There's no way they would give it up.	No	[]	[]	negative	0-10	0	0	0.0	0
37463	They're able to charge women more for the same exact procedure a man gets.	Yes	[]	[]	positive	11-20	1	0	0.0	0
37470	As far as a say is concerned, the people already had their say.	No	[]	[]	neutral	11-20	0	0	0.0	0
37504	I am the Democratic Party right now.	No	[]	[]	positive	0-10	0	0	0.0	0
37510	There's seven million people that contracted COVID.	Yes	[]	[]	negative	0-10	1	0	0.0	0
37513	So don't tell me about this.	No	[]	[]	negative	0-10	0	0	0.0	0
37514	I'm happy to talk about this.	No	[]	[]	extremely_positive	0-10	0	0	0.0	0
37519	You would have been much later, Joe, much later.	No	[]	[]	negative	0-10	0	0	0.0	0
37528	And so the election is all-	No	[]	[]	negative	0-10	0	0	0.0	0
37531	Why is it on the ballot?	No	[]	[]	negative	0-10	0	0	0.0	0
37571	And we will protect people.	No	[]	[]	negative	0-10	0	0	0.0	0
37589	I'll give you an example.	No	[]	[]	negative	0-10	0	0	0.0	0
37593	Take a at all of the drugs that what we're doing.	No	[]	[]	negative	11-20	0	0	0.0	0
37623	On Super Tuesday, you got very lucky.	No	[]	[]	positive	0-10	0	0	0.0	0
37628	And tonight I'm going to make sure.	No	[]	[]	positive	0-10	0	0	0.0	0
37630	Because here's the deal, here's the deal.	No	[]	[]	negative	0-10	0	0	0.0	0
37631	The fact is that everything he's saying so far is simply a lie.	Yes	[]	[]	neutral	11-20	1	0	0.0	0
37643	The wrong guy, the wrong night, at the wrong time.	No	[]	[]	very_negative	0-10	0	0	0.0	0
37651	You agreed with Bernie Sanders on a plan that you absolutely agreed to and under that plan , they call it socialized medicine.	Yes	[]	[]	neutral	21-30	1	0	0.0	0
37664	He has never offered a plan.	Yes	[]	[]	negative	0-10	1	0	0.0	0
37672	We took away the individual mandate.	Yes	[]	[]	negative	0-10	1	0	0.0	0
37673	We guaranteed pre-existing conditions, but took away the individual mandate.	Yes	[]	[]	negative	0-10	1	0	0.0	0
37677	If I run it badly, they'll probably blame him, but they'll blame me.	No	[]	[]	very_negative	11-20	0	0	0.0	0
37678	But more importantly, I want to help people.	No	[]	[]	positive	0-10	0	0	0.0	0
37685	So we do want to get rid of it.	No	[]	[]	negative	0-10	0	0	0.0	0
37702	And the fact is this man doesn't know what he's talking about.	No	[]	[]	negative	11-20	0	0	0.0	0
37710	Whatever position I take on that'll become the issue.	No	[]	[]	negative	0-10	0	0	0.0	0
37711	The issue is the American people should speak.	No	[]	[]	negative	0-10	0	0	0.0	0
37722	You want to put a lot of new Supreme Court Justices.	No	[]	[]	neutral	11-20	0	0	0.0	0
37724	Will you shut up, man?	No	[]	[]	negative	0-10	0	0	0.0	0
37725	Who is on your list, Joe?	No	[]	[]	negative	0-10	0	0	0.0	0
37749	We, in fact, have 4% of the world's population, 20% of the deaths.	Yes	[]	[]	negative	11-20	1	0	0.0	0
37750	40000 people a day are contracting COVID.	Yes	[]	[]	negative	0-10	1	0	0.0	0
37753	It is what it is because you are who you are.	No	[]	[]	negative	11-20	0	0	0.0	0
37764	In addition to that, what did he do?	No	[]	[]	negative	0-10	0	0	0.0	0
37770	And what did he do then?	No	[]	[]	negative	0-10	0	0	0.0	0
37777	I laid out back in March, exactly what we should be doing.	No	[]	[]	neutral	11-20	0	0	0.0	0
37778	And I laid out again in July, what we should be doing.	No	[]	[]	negative	11-20	0	0	0.0	0
37779	We should be providing all the protective gear possible.	No	[]	[]	negative	0-10	0	0	0.0	0
37802	Many of your Democrat Governors said, President Trump did a phenomenal job.	Yes	[]	[]	positive	11-20	1	0	0.0	0
37816	Far fewer people are dying.	Yes	[]	[]	neutral	0-10	1	0	0.0	0
37817	We've done a great job.	No	[]	[]	extremely_positive	0-10	0	0	0.0	0
37824	But I'll tell you, Joe, you could never have done the job that we did.	No	[]	[]	negative	11-20	0	0	0.0	0
37839	How many of you got up this morning and had an empty chair at the kitchen table because someone died of COVID?	No	[]	[]	neutral	21-30	0	0	0.0	0
37840	How many of you are in a situation where you lost your mom or dad and you couldn't even speak to them, you had a nurse holding a phone up so you could in fact say goodbye?	No	[]	[]	positive	31-40	0	0	0.0	0
37875	It could also be after that.	No	[]	[]	negative	0-10	0	0	0.0	0
37903	No more than the question you just asked him.	No	[]	[]	very_negative	0-10	0	0	0.0	0
37916	They're the people... And by the way-	No	[]	[]	negative	0-10	0	0	0.0	0
37929	Did you use the word smart?	No	[]	[]	neutral	0-10	0	0	0.0	0
37945	I forward to talking about it.	No	[]	[]	negative	0-10	0	0	0.0	0
37956	Tell that to Nancy Pelosi.	No	[]	[]	negative	0-10	0	0	0.0	0
37962	He sits in his golf course.	No	[]	[]	negative	0-10	0	0	0.0	0
37971	He wants to shut down the country.	Yes	[]	[]	neutral	0-10	1	0	0.0	0
37978	More people will be hurt by continuing.	No	[]	[]	positive	0-10	0	0	0.0	0
37989	I got to respond to that.	No	[]	[]	negative	0-10	0	0	0.0	0
37994	No, I think masks are okay.	No	[]	[]	positive	0-10	0	0	0.0	0
38023	Dr. Fauci said the opposite.	Yes	[]	[]	negative	0-10	1	0	0.0	0
38075	He's been totally irresponsible the way in which he has handled the social distancing and people wearing masks, basically encouraged them not to.	Yes	[]	[]	neutral	21-30	1	0	0.0	0
38077	If you could get the crowds, you would have done the same thing.	No	[]	[]	negative	11-20	0	0	0.0	0
38099	One person is too much.	No	[]	[]	neutral	0-10	0	0	0.0	0
38121	And you at what's going on with divorce, at what's going on with alcoholism and drugs.	No	[]	[]	negative	11-20	0	0	0.0	0
38135	This guy paid a total of 750 dollars in taxes.	Yes	[]	[]	negative	0-10	1	0	0.0	0
38144	The fact is that he has in fact, worked on this in a way that he's going to be the first president of the United States to leave office, having fewer jobs in his administration than when he became president.	Yes	[]	[]	neutral	31-40	1	0	0.0	0
38156	Because it costs a lot of money to open them safely.	Yes	[]	[]	neutral	11-20	1	0	0.0	0
38169	Excuse me, he made a statement.	No	[]	[]	negative	0-10	0	0	0.0	0
38179	They want to get back to their lives.	No	[]	[]	negative	0-10	0	0	0.0	0
38194	I paid millions of dollars in taxes, millions of dollars of income tax.	Yes	[]	[]	negative	11-20	1	0	0.0	0
38197	I paid 38 dollars million one year, I paid 27 dollars million one year.	Yes	[]	[]	negative	11-20	1	0	0.0	0
38220	Chris, let me just say something, that it was the tax laws.	No	[]	[]	negative	11-20	0	0	0.0	0
38221	I don't want to pay tax.	No	[]	[]	negative	0-10	0	0	0.0	0
38234	And I'm going to eliminate those tax cuts.	No	[]	[]	negative	0-10	0	0	0.0	0
38236	And make sure that we invest in the people who in fact need the help.	No	[]	[]	positive	11-20	0	0	0.0	0
38238	But why didn't you do it over the last 25 years?	No	[]	[]	negative	11-20	0	0	0.0	0
38247	We've done things that you never even thought of doing.	No	[]	[]	negative	0-10	0	0	0.0	0
38262	And under my proposal, we're going to make sure that every penny of that has to be made by a company-	No	[]	[]	positive	21-30	0	0	0.0	0
38264	By the way, I'm going to eliminate a significant number of the taxes.	No	[]	[]	positive	11-20	0	0	0.0	0
38265	I'm going to make the corporate tax 28%.	No	[]	[]	negative	0-10	0	0	0.0	0
38284	They had the slowest economic recovery since 1929.	Yes	[]	[]	neutral	0-10	1	0	0.0	0
38291	If you got in, if you ever became president with your ideas, you want to terminate my taxes.	No	[]	[]	negative	11-20	0	0	0.0	0
38294	And plenty of companies that are already here, they'll leave for other places.	Yes	[]	[]	negative	11-20	1	0	0.0	0
38310	Manufacturing went in a hole-	Yes	[]	[]	negative	0-10	1	0	0.0	0
38322	I brought back 700000 jobs.	Yes	[]	[]	negative	0-10	1	0	0.0	0
38349	We have a higher deficit with China now than we did before.	Yes	[]	[]	neutral	11-20	1	0	0.0	0
38359	What did he do to deserve it?	No	[]	[]	negative	0-10	0	0	0.0	0
38421	Some people don't do a good job.	No	[]	[]	very_positive	0-10	0	0	0.0	0
38435	We want to talk about families and ethics.	No	[]	[]	negative	0-10	0	0	0.0	0
38510	He came out of his bunker, had the military use tear gas on them so he could walk across to a church and hold up a Bible.	Yes	[]	[]	negative	21-30	1	0	0.0	0
38511	And then what happened after that?	No	[]	[]	negative	0-10	0	0	0.0	0
38513	The general who was with him said All he ever wants to do is divide people not unite people at all.	Yes	[]	[]	neutral	21-30	1	0	0.0	0
38547	And why aren't you saying those words, Joe?	No	[]	[]	negative	0-10	0	0	0.0	0
38562	There's systemic injustice in this country, in education and work and in law enforcement and the way in which it's enforced.	Yes	[]	[]	negative	21-30	1	0	0.0	0
38568	They have to be held accountable.	No	[]	[]	negative	0-10	0	0	0.0	0
38578	When they run through the middle of the town-	No	[]	[]	negative	0-10	0	0	0.0	0
38597	If you were a certain person, you had no status in life.	No	[]	[]	neutral	11-20	0	0	0.0	0
38599	And if you at the people, we would pay people hundreds of thousands of dollars to teach very bad ideas and frankly, very sick ideas.	No	[]	[]	very_negative	21-30	0	0	0.0	0
38603	We have to go back to the core values of this country.	No	[]	[]	negative	11-20	0	0	0.0	0
38607	And I'm not going to allow that to happen.	No	[]	[]	negative	0-10	0	0	0.0	0
38618	People have to be made aware of what other people feel like, what insults them, what is demeaning to them.	No	[]	[]	neutral	21-30	0	0	0.0	0
38619	It's important that people know.	No	[]	[]	positive	0-10	0	0	0.0	0
38623	It's a little bit like how this guy and his friends down on so many people.	No	[]	[]	neutral	11-20	0	0	0.0	0
38630	There's nothing we cannot do, if we do it together.	No	[]	[]	negative	0-10	0	0	0.0	0
38639	What happened in Baltimore.	No	[]	[]	negative	0-10	0	0	0.0	0
38666	The places we had trouble were Democratic-run cities...	Yes	[]	[]	negative	0-10	1	0	0.0	0
38671	I think it's a party issue.	No	[]	[]	negative	0-10	0	0	0.0	0
38675	The numbers are going up a 100, 150, 200 percent, crime, it is crazy what's going on ...	Yes	[]	[]	very_negative	11-20	1	0	0.0	0
38687	I was raised in the suburbs.	No	[]	[]	negative	0-10	0	0	0.0	0
38711	That's not what it ...	No	[]	[]	negative	0-10	0	0	0.0	0
38774	And so here's the point.	No	[]	[]	negative	0-10	0	0	0.0	0
38777	Instead of going in and talking to people and saying, Let's get everybody together.	No	[]	[]	negative	11-20	0	0	0.0	0
38786	You mean, I have to answer his stuff?	No	[]	[]	very_negative	0-10	0	0	0.0	0
38798	I'll send in the National Guard, it would be over.	No	[]	[]	negative	0-10	0	0	0.0	0
38821	Proud Boys, stand back and stand by.	No	[]	[]	positive	0-10	0	0	0.0	0
38862	And we now got a 91% approval rating at the VA, our vets.	Yes	[]	[]	negative	11-20	1	0	0.0	0
38863	We take care of our vets.	No	[]	[]	negative	0-10	0	0	0.0	0
38868	Because President Obama and him left me 128 judges to fill.	Yes	[]	[]	negative	11-20	1	0	0.0	0
38872	You can't be a good Vice President but I want to thank you because it gives us almost, it'll probably be above that number.	No	[]	[]	positive	21-30	0	0	0.0	0
38882	With regard to being weaker, the fact is that I've gone head to head with Putin and made it clear to him we're not going to take any of his stuff.	Yes	[]	[]	neutral	31-40	1	0	0.0	0
38884	He still refuses to even say anything to Putin about the bounty on the heads of American soldiers.	Yes	[]	[]	negative	11-20	1	0	0.0	0
38906	When we were in office there were 15% less violence in America than there is today.	Yes	[]	[]	negative	11-20	1	0	0.0	0
38913	He spent a year there.	No	[]	[]	negative	0-10	0	0	0.0	0
38920	Are you talking Hunter, are you talking about Hunter.	No	[]	[]	negative	0-10	0	0	0.0	0
38936	My son... like a lot of people.	No	[]	[]	negative	0-10	0	0	0.0	0
38961	Why did he get it?	No	[]	[]	negative	0-10	0	0	0.0	0
38979	If you at the Paris Accord, it was a disaster from our standpoint.	No	[]	[]	negative	11-20	0	0	0.0	0
38991	But I also think we have to do better management of our forests.	No	[]	[]	positive	11-20	0	0	0.0	0
38999	I was with the head of a major country, it's a forest city.	No	[]	[]	neutral	11-20	0	0	0.0	0
39002	I spoke with the Governor about it.	No	[]	[]	negative	0-10	0	0	0.0	0
39018	Now, so, and by the way, we're going to see how that turns out.	No	[]	[]	negative	11-20	0	0	0.0	0
39022	And I'm okay with electric cars too.	No	[]	[]	positive	0-10	0	0	0.0	0
39037	Making sure that we can do that, we're going to put 500000 charging stations and all of the highways that we're going to be building in the future.	No	[]	[]	neutral	21-30	0	0	0.0	0
39044	And the first thing I will do, I will rejoin the Paris Accord.	No	[]	[]	neutral	11-20	0	0	0.0	0
39048	Brazil, the rainforests of Brazil are being torn down, are being ripped down.	Yes	[]	[]	negative	11-20	1	0	0.0	0
39075	That is not, that is not...	No	[]	[]	negative	0-10	0	0	0.0	0
39086	That is simply not the case...	No	[]	[]	negative	0-10	0	0	0.0	0
39105	You did say that.	Yes	[]	[]	negative	0-10	1	0	0.0	0
39120	So why didn't he do it for 47 years?	Yes	[]	[]	negative	0-10	1	0	0.0	0
39129	The Green New Deal is a hundred trillion dollars...	Yes	[]	[]	negative	0-10	1	0	0.0	0
39132	The Green New Deal is not my plan...	Yes	[]	[]	negative	0-10	1	0	0.0	0
39135	If you knew anything about...	No	[]	[]	negative	0-10	0	0	0.0	0
39139	He made a statement about the military.	No	[]	[]	negative	0-10	0	0	0.0	0
39189	They should go to iwillvote.com.	No	[]	[]	negative	0-10	0	0	0.0	0
39198	And this is all about trying to dissuade people from voting because he's trying to conf--to scare people into thinking that it's not going to be legitimate.	Yes	[]	[]	negative	21-30	1	0	0.0	0
39203	If you're able to vote in person, vote in person.	No	[]	[]	positive	0-10	0	0	0.0	0
39216	Just make sure you understand, you have it in your control to determine what this country is gonna like the next four years.	No	[]	[]	neutral	21-30	0	0	0.0	0
39217	Is it going to change, or are you going to get four more years of these lies?	No	[]	[]	positive	11-20	0	0	0.0	0
39224	From the day I came down the escalator with our first lady, they were a disaster.	No	[]	[]	neutral	11-20	0	0	0.0	0
39256	Take a at what happened in New Jersey.	No	[]	[]	neutral	0-10	0	0	0.0	0
39296	You do a solicited ballot, and that's okay...	No	[]	[]	positive	0-10	0	0	0.0	0
39305	... like they used to in the old...	No	[]	[]	neutral	0-10	0	0	0.0	0
39309	Did you see what's going on?	No	[]	[]	negative	0-10	0	0	0.0	0
39342	When you file-when you get a ballot and you fill it out, you're supposed to have an affidavit.	No	[]	[]	negative	11-20	0	0	0.0	0
39353	... sent in and swamping the system...	No	[]	[]	negative	0-10	0	0	0.0	0
39373	In Philadelphia, they went in to watch.	No	[]	[]	negative	0-10	0	0	0.0	0
39392	I'll tell you what it means...	No	[]	[]	negative	0-10	0	0	0.0	0
39394	It means you have a fraudulent election.	Yes	[]	[]	negative	0-10	1	0	0.0	0
39412	Some of these ballots in some states can't even be opened until election day.	Yes	[]	[]	negative	11-20	1	0	0.0	0
39414	And by the way, our military--they've been voting by ballots for since the end of the Civil War, in effect.	Yes	[]	[]	negative	11-20	1	0	0.0	0
39421	Take a at Carolyn Maloney's race...	No	[]	[]	negative	0-10	0	0	0.0	0
39430	The fact is, I will accept it, and he will too.	No	[]	[]	negative	11-20	0	0	0.0	0
39435	If it's not me, I'll support the outcome.	No	[]	[]	negative	0-10	0	0	0.0	0
39479	You see the spikes in Europe and many other places right now.	Yes	[]	[]	neutral	11-20	1	0	0.0	0
39480	If you notice, the mortality rate is down, 85%.	Yes	[]	[]	negative	0-10	1	0	0.0	0
39481	The excess mortality rate is way down, and much lower than almost any other country.	Yes	[]	[]	negative	11-20	1	0	0.0	0
39492	I can tell you from personal experience that I was in the hospital, I had it.	No	[]	[]	negative	11-20	0	0	0.0	0
39497	Whether it's four months or a lifetime, nobody's been able to say that, but I'm immune.	No	[]	[]	positive	11-20	0	0	0.0	0
39506	If you hear nothing else I say tonight, hear this.	No	[]	[]	negative	0-10	0	0	0.0	0
39507	Anyone who's responsible for not taking control - in fact, not saying, I take no responsibility, initially - anyone who is responsible for that many deaths should not remain as President of the United States of America.	No	[]	[]	neutral	31-40	0	0	0.0	0
39508	We're in a situation where there are thousands of deaths a day, a thousand deaths a day.	Yes	[]	[]	negative	11-20	1	0	0.0	0
39510	Compared to what's going on in Europe, as the New England Medical Journal said, they're starting from a very low rate.	Yes	[]	[]	neutral	21-30	1	0	0.0	0
39514	And we're in a circumstance where the President, thus far, still has no plan.	Yes	[]	[]	neutral	11-20	1	0	0.0	0
39517	I would make sure we move in the direction of rapid testing, investing in rapid testing.	No	[]	[]	positive	11-20	0	0	0.0	0
39526	No, it's not a guarantee but it will be by the end of the year, but I think it has a good chance.	No	[]	[]	very_positive	21-30	0	0	0.0	0
39543	Make sure it's totally transparent.	No	[]	[]	neutral	0-10	0	0	0.0	0
39550	I don't think we're going to have a dark winter at all.	No	[]	[]	negative	11-20	0	0	0.0	0
39553	When I closed and banned China from coming in heavily infected, and then ultimately Europe, but China was in January - months later he was saying I was xenophobic, I did it too soon.	Yes	[]	[]	negative	31-40	1	0	0.0	0
39560	His own person who ran that for him who, as you know was his chief of staff, said 'It was catastrophic, it was horrible, we didn't know what we were doing.'	Yes	[]	[]	negative	31-40	1	0	0.0	0
39565	And he did it late, after 40 countries had already done that.	Yes	[]	[]	very_negative	11-20	1	0	0.0	0
39586	I'd love to put myself in the basement or in a beautiful room in the White House and go away for a year and a half until it disappears.	No	[]	[]	positive	21-30	0	0	0.0	0
39601	Can I respond to that?	No	[]	[]	negative	0-10	0	0	0.0	0
39615	What should they do about the danger?	No	[]	[]	negative	0-10	0	0	0.0	0
39625	They kept it from going into the rest of China, for the most part, but they didn't keep it from coming out to the world including Europe and ourselves.	Yes	[]	[]	positive	21-30	1	0	0.0	0
39627	The fact is, that when we knew it was coming, when it hit - what happened?	No	[]	[]	negative	11-20	0	0	0.0	0
39673	I think we have to respond, if I might.	No	[]	[]	negative	0-10	0	0	0.0	0
39679	And he supports all these people.	Yes	[]	[]	negative	0-10	1	0	0.0	0
39685	Young people, I guess it's their immune system.	No	[]	[]	neutral	0-10	0	0	0.0	0
39697	There's depression, alcohol, drugs at a level that nobody's ever seen before.	Yes	[]	[]	negative	11-20	1	0	0.0	0
39704	We're gonna be able to walk and chew gum at the same time.	No	[]	[]	neutral	11-20	0	0	0.0	0
39720	I mean, you're going to sit there in a cubicle wrapped around with plastic?	No	[]	[]	very_negative	11-20	0	0	0.0	0
39723	For so many years, I loved it.	No	[]	[]	very_positive	0-10	0	0	0.0	0
39735	The money's already been passed to do that.	Yes	[]	[]	negative	0-10	1	0	0.0	0
39737	Kristen, New York has lost more than 40000 people.	Yes	[]	[]	positive	0-10	1	0	0.0	0
39746	We can't let that happen, Joe, you can't let that happen.	No	[]	[]	negative	11-20	0	0	0.0	0
39747	We have to open up and we understand the disease, we have to protect our seniors, we have to protect our elderly, we have to protect, especially, our seniors with heart problems and diabetes problems, and we will protect them.	No	[]	[]	negative	31-40	0	0	0.0	0
39775	But, guess what, in the meantime, we find out in the New York Times the other day that in fact, his folks went to Wall Street and said, 'this is a really dangerous thing,' and a memo out of that meeting - not from his administration, but from some of the brokers - said, 'sell short, because we gotta get moving.	Yes	[]	[]	negative	61-70	1	0	0.0	0
39786	But I don't want to do that because it puts me in a bad position.	No	[]	[]	very_negative	11-20	0	0	0.0	0
39788	You shouldn't be bringing up Wall Street.	No	[]	[]	negative	0-10	0	0	0.0	0
39793	In fact, we beat Hillary Clinton with a tiny fraction of the money that she was able to get.	Yes	[]	[]	neutral	11-20	1	0	0.0	0
39794	Don't tell me about Wall Street.	No	[]	[]	negative	0-10	0	0	0.0	0
39806	They will pay a price.	No	[]	[]	negative	0-10	0	0	0.0	0
39809	They will pay a price if I'm elected.	No	[]	[]	negative	0-10	0	0	0.0	0
39820	We are in a situation where we have foreign countries trying to interfere in the outcome of our election.	Yes	[]	[]	negative	11-20	1	0	0.0	0
39823	He's being fed information that is Russian, that is not true.	Yes	[]	[]	negative	11-20	1	0	0.0	0
39837	Joe got three and a half million dollars from Russia.	Yes	[]	[]	negative	0-10	1	0	0.0	0
39839	You got three and a half million dollars.	Yes	[]	[]	negative	0-10	1	0	0.0	0
39840	Your family got three and a half million dollars and you know someday, you're gonna have to explain - why did you get three and a half?	Yes	[]	[]	negative	21-30	1	0	0.0	0
39841	I never got any money from Russia.	Yes	[]	[]	negative	0-10	1	0	0.0	0
39848	I sold - while he was selling pillows and sheets - I sold tank busters to Ukraine.	Yes	[]	[]	negative	11-20	1	0	0.0	0
39850	And I'll tell you, they were so bad.	No	[]	[]	very_negative	0-10	0	0	0.0	0
39851	They took over the submarine port.	Yes	[]	[]	negative	0-10	1	0	0.0	0
39856	They were paying you a lot of money and they probably still are, but now, with what came out today, it's even worse.	Yes	[]	[]	very_negative	21-30	1	0	0.0	0
39867	We learn that this President paid 50 times the tax in China, has a secret bank account with China, does business in China, and in fact, is talking about me taking money?	Yes	[]	[]	very_negative	31-40	1	0	0.0	0
39868	I have not taken a single penny from any country whatsoever, ever, number one.	Yes	[]	[]	negative	11-20	1	0	0.0	0
39876	The foreign countries are paying you a lot.	Yes	[]	[]	negative	0-10	1	0	0.0	0
39886	I want to do it, and it will show how successful, how great this company is.	No	[]	[]	extremely_positive	11-20	0	0	0.0	0
39895	So, I already prepaid it.	Yes	[]	[]	negative	0-10	1	0	0.0	0
39902	Number two, I don't make money from China, you do.	Yes	[]	[]	negative	0-10	1	0	0.0	0
39908	I don't know, maybe you're not.	No	[]	[]	negative	0-10	0	0	0.0	0
39910	Your son said we have to give 10% to the big man.	Yes	[]	[]	negative	11-20	1	0	0.0	0
39918	I get treated worse than the Tea Party got treated.	No	[]	[]	very_negative	0-10	0	0	0.0	0
39938	Come on, come on, folks.	No	[]	[]	negative	0-10	0	0	0.0	0
39940	I was put through a phony witch hunt for three years.	Yes	[]	[]	negative	11-20	1	0	0.0	0
39973	His son didn't have a job for a long time, was sadly no longer in the military service, I won't get into that.	No	[]	[]	neutral	21-30	0	0	0.0	0
39980	Everybody investigated that, no one said anything he did was wrong in Ukraine.	Yes	[]	[]	very_negative	11-20	1	0	0.0	0
39994	Excuse me, and then unlike him, where he's Vice President, and he does business, I then decided to run for president after that.	No	[]	[]	negative	21-30	0	0	0.0	0
40004	What I'd make China do is play by the international rules, not like he has done.	No	[]	[]	negative	11-20	0	0	0.0	0
40018	We need to be having the rest of our friends with us, saying to China, these are the rules.	No	[]	[]	negative	11-20	0	0	0.0	0
40025	His son walked out with a billion and a half dollars from China -	Yes	[]	[]	negative	11-20	1	0	0.0	0
40034	China is paying.	Yes	[]	[]	neutral	0-10	1	0	0.0	0
40059	You're sitting at the kitchen table this morning deciding, we can't get new tires, they're bald, because we have to wait another month or so.	No	[]	[]	neutral	21-30	0	0	0.0	0
40075	Let's get off the subject of China, let's talk around sitting around the table.	No	[]	[]	negative	11-20	0	0	0.0	0
40082	So, when I met with Barack Obama, we sat in the White House, right at the beginning had a great conversation, was supposed to be 15 minutes and it was over an hour.	No	[]	[]	positive	31-40	0	0	0.0	0
40111	On the condition that he would agree that he would be drawing down his nuclear capacity to get -- the Korean Peninsula should be a nuclear free zone.	No	[]	[]	neutral	21-30	0	0	0.0	0
40138	Remember the first two or three months.	No	[]	[]	neutral	0-10	0	0	0.0	0
40150	Through the legislature, I terminated the individual mandate.	Yes	[]	[]	negative	0-10	1	0	0.0	0
40152	The individual mandate -- where you have to pay a fortune for the privilege of not having to pay for bad health insurance.	Yes	[]	[]	very_negative	21-30	1	0	0.0	0
40153	I terminated it; it's gone.	Yes	[]	[]	negative	0-10	1	0	0.0	0
40156	I could have gone the other route and made everybody very unhappy.	No	[]	[]	very_negative	11-20	0	0	0.0	0
40163	I don't know that it's going to work.	No	[]	[]	negative	0-10	0	0	0.0	0
40168	What I would like to do is a much better health care, much better.	No	[]	[]	positive	11-20	0	0	0.0	0
40169	We'll always protect people with pre-existing - so I'd like to terminate Obamacare, come up with a brand new beautiful health care.	No	[]	[]	positive	21-30	0	0	0.0	0
40172	And I think we're going to win the House, okay?	No	[]	[]	very_positive	0-10	0	0	0.0	0
40173	You'll see, but I think we're gonna win the House.	No	[]	[]	extremely_positive	0-10	0	0	0.0	0
40175	We have 180 million people out there that have great private health care, far more than we're talking about with Obamacare.	Yes	[]	[]	positive	21-30	1	0	0.0	0
40212	It's gotten endorsed by all the major labor unions as, as a whole range of other people who in fact, are concerned in the medical field.	Yes	[]	[]	neutral	21-30	1	0	0.0	0
